7544318,49,湖北,湖北武汉,0,本科,女,165,1968年中国制造，长165cm，净重56kg。采用人工智能，各部分零件齐全，运转稳定，经三十多年的运行，属质量信得过产品。该“产品”手续齐全，无限期包退包换。现因发展需要，诚招志同道合者，有意者请联系！本人成分：59%的美，40%的柔，1%的微量胆量；适用范围：40~45岁的摔锅；主治：心情不爽、缺少朋友、生活无聊；警告：长期服用会产生较严重的依赖性和对其他女性的排斥性！,0,0,0,0,0,爱*咏恒,无,正在恋爱中,自信/身材匀称/有神论,与父母同住,匀称,56,,,科研/教育,,离异,不限,不限,其它,,河北石家庄,,猴,,,40~48岁,挑战者型,,,湖北省,,不限,,天蝎座,不吸烟，但不反感,不喝酒,不想,7000-10000,2000-5000,有，和我住一起,,,,汉族,,,,,,8,生产/营运,B型,已购房(无贷款),,165~185厘米
4322522,31,上海,上海松江,2,本科,女,163,一直在执着地坚信着，这世界还是有唯美、浪漫的爱情的。只是一直没有遇到。年龄、阅历的增长让我从一个理想主义者慢慢学会理智。不再去奢求爱情有多浪漫，只求真实、平淡；不再奢求婚后生活有多美满，只求幸福、温馨、平凡。相信，缘分！,0,1,0,0,1,豃触緈鍢,无,已经结婚了,身材匀称/有神论,住单位房,匀称,50,,,科研/教育,,已婚,未婚,不限,佛教,,江苏泰州,,虎,,,25~31岁,艺术家型,,,上海市,,不限,,天秤座,不吸烟，但不反感,不喝酒,想,"2000以下,4000-5000,7000-10000,15000-20000,30000-50000",2000-5000,没有,,,,汉族,,,,,,7,生产/营运,O型,",与父母同住,需要时购置,已购房(无贷款),住单位房,住亲朋家",,175~180厘米
50209748,43,湖北,湖北十堰,0,高中,女,162,合适的就是最好的向往简单生活简单爱希望能找到即使经历过风雨仍然能保持一颗赤子之心的你快乐生活快乐爱刚登记时未婚，现在已经结婚啦，感谢百合，呵呵！也祝所的朋友们找到自己适合的另一半！,0,0,0,0,0,笑笑,无,已经结婚了,自信/无神论/身材匀称/销售员,与父母同住,匀称,52,,,计算机/网络,,已婚,不限,不限,无神论,,湖北十堰,,兔,,,31~41岁,艺术家型,,,湖北省,,不限,,双鱼座,不吸烟，但不反感,不喝酒,还没想好,"2000以下,4000-5000,7000-10000,15000-20000,30000-50000",2000以下,没有,,,,汉族,,,,,,8,销售,其它,已购房(无贷款),,170~196厘米
56529036,31,海南,海南省其它,3,高中,女,155,我希望我以后的男友会宠我·爱我·~~他可以不是很帅，带得出去就行。不富裕也行，但是一定要让我三餐无忧~~要有孝心，爱心，但不可以花心！,0,1,1,0,1,請芴咑撓,有,已经结婚了,身材匀称/有神论/少数民族,与父母同住,匀称,44,,,其它,,已婚,未婚,不限,佛教,,,,兔,,,23~33岁,表演者型,,,海南省,,不限,中文(普通话),双子座,不吸烟，但不反感,兴致时小酌,想,4000-5000,2000以下,没有,,,,其它民族,,,,,,5,其它,A型,"与父母同住,已购房(无贷款),住单位房",,167~174厘米
4088658,35,辽宁,辽宁大连,0,本科,女,171,快乐就好。。。,0,0,0,0,0,止水,有,已经结婚了,无神论/高个子/身材匀称/少数民族,住单位房,匀称,60,,,计算机/网络,,已婚,未婚,不限,无神论,,内蒙古呼和浩特,,狗,,,25~30岁,艺术家型,,,辽宁省,,不限,,处女座,不吸烟，但不反感,兴致时小酌,不想,4000-5000,2000-5000,没有,,,,蒙古族,,,,,,7,教育/培训,A型,",与父母同住,需要时购置,已购房(无贷款),住单位房,住亲朋家",,178~185厘米
62429454,32,吉林,吉林长春,2,中专/职高/技校,女,161,这个网号是朋友的，因为朋友已经在这个平台上找到了自己的另一伴，所以继续朋友的幸运用了她的网号。本人未婚。爱情不是荣华富贵，而是相濡以沫。结婚本是一件幸福的事，前提是嫁给会把我当宝的人如果想,0,1,0,0,1,蝶舞芳菲,无,已经结婚了,看重感觉/身材丰满/无神论/工作轻松/厨艺不错/随和,,丰满,60,牵手漫步在公园,私营企业,健康/医疗,能做几样可口的小菜,已婚,不限,不限,无神论,老二,吉林长春,看各自闲忙，协商分担,牛,朝九晚五,性格，心灵,30~40岁,发明家型,时机成熟时就结婚,,吉林省,,不限,中文(普通话),处女座,不吸烟，但不反感,不喝酒,想,"2000以下,4000-5000,7000-10000,15000-20000,30000-50000",2000以下,没有,中式婚礼，宴请宾客,,,汉族,,,父母健在,,早睡早起,5,生物/制药/医疗器械,O型,",已购房(无贷款)",,176~196厘米
6498051,39,江苏,江苏苏州,0,本科,女,160,我一直坚信，我的他一直在百合等我，和我一样期待着与我相逢的那一天！在我们终于相遇的那一刻，我们会从此携手，以婚姻为轴心，用各自的努力和真诚做圆弧，将我们共同的人生画得圆满幸福……本人最大的愿望：能够和一位相爱的男士结婚，早上在他之前醒来，晚上在他之后睡去，为他做我最拿手的饭菜，亲吻并清洗他换下的带有烟草味的衬衣，为他生一个白白胖胖漂亮可爱的孩子，为他照顾并孝顺他年老体衰的父母，陪他接受人生暴风雨的洗礼，陪他坐看暮年时的花开花落……,0,0,0,0,0,一叶轻愁,有,已经结婚了,有神论/身材匀称,需要时购置,匀称,49,,,公关/广告,,已婚,不限,不限,信神但未定教,,江苏南通,,马,,,28~40岁,专家型,,,江苏省,,不限,中文(普通话),射手座,不吸烟，但不反感,不喝酒,想,"4000-5000,7000-10000,15000-20000,30000-50000",2000以下,没有,,,,汉族,,,,,,7,其它,A型,已购房(无贷款),,168~180厘米
50257600,33,河南,河南郑州,0,本科,女,168,"喜欢用感觉来对待人生。活泼开朗。身舞动,心飞扬.青春编织梦想,展现自我风采.跳动属于自我的旋律,承载自我的生命.",0,0,0,0,0,ADL,无,已经结婚了,销售员/有神论/自信/身材匀称,需要时购置,匀称,52,,,计算机/网络,,已婚,未婚,不限,佛教,,吉林长春,,鼠,,,23~28岁,记者型,,,河南省,,不限,中文(普通话),天秤座,不吸烟，但不反感,兴致时小酌,想,"2000以下,4000-5000,7000-10000,15000-20000,30000-50000",2000以下,没有,,,,汉族,,,,,,9,销售,B型,已购房(无贷款),,178~187厘米
3407509,36,上海,上海宝山,0,本科,女,157,通过百合找到了生命的另一半，真心希望网站越来越好，大家都能有属于自己的幸福生活:),0,0,0,0,0,helen,无,已经结婚了,无神论/身材丰满,,丰满,50,,,计算机/网络,,已婚,未婚,不限,无神论,,上海闸北,,鸡,,,26~33岁,公务员型,,,上海市,,不限,,天蝎座,不吸烟，但不反感,不喝酒,想,"4000-5000,7000-10000",2000-5000,没有,,,,汉族,,,,,,7,教育/培训,B型,已购房(无贷款),,167~175厘米
53997652,30,辽宁,辽宁大连,0,本科,女,153,我是一个非常自信的女孩，因为我相信，自信的女孩最美丽！忽然有一天，我发现我需要一个家，需要一个男人从心里真正的懂我。我忽然好希望能够为我爱的人做一份早餐，看着他吃东西的样子，我会感到很甜蜜……于是，我来到了这里，希望能在这找到我人生的另一半。,0,0,0,0,0,幸福甜蜜蜜,有,正在恋爱中,在校生/身材苗条/有神论,与父母同住,较瘦,82,,,其它,,未婚,"未婚,丧偶",不限,佛教,,辽宁大连,,龙,,,20~23岁,教师型,,,辽宁省,,不限,,巨蟹座,不吸烟，但不反感,不喝酒,想,"2000以下,7000-10000,15000-20000,30000-50000",2000以下,没有,,,,汉族,,,,,,2,在校学生,A型,",与父母同住,已购房(无贷款),住单位房,住亲朋家",,160~170厘米
58857531,35,辽宁,辽宁大连,0,本科,女,163,不知不觉自己已经不小了，到了该婚的时候了，真心希望在这里能找到我心爱的他，心动不如行动，加油！加油！,0,0,1,0,0,柠檬茶,有,正在恋爱中,无神论/身材苗条,租房,苗条,49,,,,,未婚,不限,不限,无神论,,,,猪,,,27~35岁,照顾者型,,,辽宁省,,不限,中文(普通话),金牛座,不吸烟，但不反感,不喝酒,,"2000以下,4000-5000,7000-10000,15000-20000,30000-50000",2000-5000,没有,,,,汉族,,,,,,7,贸易/采购,,",与父母同住,需要时购置,已购房(无贷款),住单位房,住亲朋家",,172~190厘米
54792442,35,北京,北京朝阳,3,本科,女,169,"听朋友介绍来到这里，望众里寻他！不过很愁人，来信也看不到,这制度真让人无奈!，你能看懂",0,1,1,0,1,小欣,有,已经结婚了,有房/有神论/夜猫子/自信/随和/身材丰满,已购房(有贷款),丰满,65,,,,能做几样可口的小菜,已婚,未婚,不限,佛教,独生子女,北京朝阳,一起分工合作,狗,,,27~35岁,教师型,,,北京市,,不限,中文(普通话),处女座,不吸，很反感,不喝酒,想,"15000-20000,30000-50000",5000-10000,没有,,,,汉族,,,父母健在,,经常熬夜,8,贸易/采购,O型,已购房(无贷款),,170~180厘米
57784698,30,广东,广东深圳,1,本科,女,160,找一个真心相对，同甘共苦，真诚，有责任感的那个你，一起相濡以沫，细水长流！如果有缘加我***,0,0,1,0,0,等待,无,正在恋爱中,无神论/身材匀称,租房,匀称,48,,,,,未婚,未婚,不限,无神论,,湖北黄冈,,兔,,,23~30岁,主人型,,,广东省,,不限,中文(普通话),天蝎座,不吸烟，但不反感,不喝酒,想,"7000-10000,15000-20000",2000-5000,没有,,,,汉族,,,,,,7,财务/审计/税务,,",与父母同住,需要时购置,已购房(无贷款),住单位房,住亲朋家",,171~180厘米
1897958,35,北京,北京丰台,3,本科,女,170,期盼持我之手与我偕老的你,0,1,1,0,1,严寒,有,,高个子/工作轻松/无神论/勤快/厨艺不错/看重感觉,与父母同住,高挑,49,一起打游戏或者一起看电影,自有公司,制造业,能做几样可口的小菜,离异,不限,不限,无神论,独生子女,北京丰台,任劳任怨,狗,工作时间自由,性格，心灵,30~40岁,表演者型,时机成熟时就结婚,,北京市,艺术类,不限,中文(普通话),射手座,不吸烟，但不反感,兴致时小酌,想,"7000-10000,15000-20000,30000-50000",5000-10000,没有,简单就好，无所谓,,北京经济管理职业学院,汉族,,,父母健在,,偶尔懒散,6,艺术/设计/创意,O型,",与父母同住,需要时购置,已购房(无贷款),住单位房,住亲朋家",已购车,173~187厘米
91804702,27,四川,四川成都,2,本科,女,160,大家好，我是一个开朗，独立的女孩，现在常住地点在四川省成都市，我平时的业余时间喜欢旅行，摄影，品尝美食，唱歌，我的家庭是高知家庭，我在私营企业工作，希望在百合网能找到牵手一辈子的他。,0,1,0,0,1,泡泡,有,正在恋爱中,无神论/身材匀称,,匀称,49,,,其它,,未婚,未婚,不限,无神论,,,,羊,,,23~27岁,,,,四川省,,不限,,双鱼座,不吸烟，但不反感,不喝酒,,7000-10000,2000-5000,没有,,,西华师大,汉族,,,,,,7,人力资源,,"与父母同住,已购房(无贷款)",,175~180厘米
58142488,29,山西,山西太原,1,大专,女,166,一个善良单纯的女孩，没心没肺。但很会照顾人的哦,0,0,1,0,0,丸子小妹,有,正在恋爱中,医护人员/身材匀称/有神论,,匀称,55,,,,,未婚,未婚,不限,基督教,,山西太原,,蛇,,,22~25岁,表演者型,,,山西省,,不限,,双鱼座,不吸烟，但不反感,不喝酒,,"2000以下,4000-5000,7000-10000,15000-20000,30000-50000",2000以下,没有,,,,汉族,,,,,,3,医院/医疗/护理,O型,",与父母同住,需要时购置,已购房(无贷款),住单位房,住亲朋家",,175~178厘米
55829951,33,四川,四川成都,2,本科,女,161,"不知道怎么回事要求实名认证，但认证了还是回不了信，请发信的男生能带上你的QQ号，我看到后觉得合适会加你QQ回信给你，谢谢本人希望能通百合网找到属于自己真正的另一半，，非诚勿扰,谢谢！离异有娃娃的不要发信了哈",0,0,1,0,0,媛,有,,厨艺不错/有神论/身材匀称/随和/接受闪婚,与父母同住,匀称,50,共赴浪漫之旅,,,色香味俱全,未婚,不限,不限,佛教,老二,,看各自闲忙，协商分担,鼠,,性格，心灵,26~43岁,艺术家型,及时闪婚,,四川省,,不限,中文(普通话),天蝎座,不吸烟，但不反感,不喝酒,想,"7000-10000,15000-20000,30000-50000",2000-5000,没有,,,,汉族,,,父母健在,,偶尔懒散,,艺术/设计/创意,A型,,,165~180厘米
53163540,36,江西,江西南昌,3,本科,女,168,"爱父母，爱生活。喜欢看书.唱歌。注重与人的和善。现实并没有想象中的那么难。..快乐过好每一天.只要付出你的真诚，它会改变你的一生。对方要求:用要求自己的方式去要求别人,有家庭责任感,有孝心.善解人意.只有先种树，荒漠才会变成绿洲；只有相信爱情，爱情才会带给你希望缘是天意,份是人为。为那天的到来......",0,1,1,0,1,一飞,有,正在恋爱中,金融才俊/身材苗条/自信/有神论,需要时购置,苗条,50,,,房地产建筑业,,未婚,未婚,不限,佛教,,江西南昌,,狗,,,26~34岁,照顾者型,,,江西省,,不限,,双鱼座,不吸烟，但不反感,不喝酒,想,"4000-5000,7000-10000,15000-20000,30000-50000",2000以下,没有,,,,汉族,,,,,,9,证券/金融/投资/银行,其它,"与父母同住,已购房(无贷款),住单位房",,172~185厘米
50002794,35,北京,北京海淀,0,本科,女,160,道生于静逸，德生于谦和，慈生于博爱，善生于感恩，福生于淡泊，乐生于健康从小生长在医院的环境下，父母都是医生，待人谦和、友善、虽然是家中的独女但是自立、自强、努力的使每天都有进步。望找到一位有思想，学历重点本科及以上，从家庭和谐稳定的、有上进心的城市男孩，我们会相互关心照顾共同经营未来，相信缘分终会来临,0,0,0,0,0,郁郁葱葱的人,无,已经结婚了,身材丰满/销售员/无神论,需要时购置,丰满,50,,,科研/教育,,已婚,不限,不限,无神论,,重庆渝中,,狗,,,26~33岁,学者型,,,北京市,,不限,,天蝎座,不吸烟，但不反感,不喝酒,还没想好,"7000-10000,15000-20000,30000-50000",2000-5000,没有,,,北京林业大学,汉族,,,,,,6,销售,O型,已购房(无贷款),,168~178厘米
59413115,32,上海,上海南汇,3,本科,女,158,............,0,1,1,0,1,靜靜地,无,正在恋爱中,身材匀称/随和/工作轻松/看重感觉/早起鸟/有上进心,与父母同住,匀称,39,牵手漫步在公园,,政府机关,不太会，但愿为心爱的人学习,丧偶,"未婚,离异",不限,无神论,独生子女,,看各自闲忙，协商分担,牛,朝九晚五,性格，心灵,25~32岁,记者型,时机成熟时就结婚,,上海市,管理类,不限,中文(普通话),水瓶座,不吸烟，但不反感,不喝酒,想,"4000-5000,7000-10000,15000-20000,30000-50000",2000-5000,没有,旅游结婚，不大操大办,,,汉族,,,父母健在,,早睡早起,,其它,B型,已购房(无贷款),,170~183厘米
67304199,31,广东,广东东莞,3,高中,女,162,"来自江西南昌,现在东莞工作的开朗，独立的86后小女子由于繁忙的工作和自己的慢热还未来得及遇到内心最期待的感情愿在这个阳光明媚的转角遇见你，遇见完整的自己～工作之业余时间喜欢旅行,登山等户外活动.感谢父母的辛勤培养,能找到幸福的归宿我想是对二老最好的回报.茫茫人海中.请你一定要向我游走唷,因为我一直在努力等你^^期待着我们幸福的小三口之家.愿得一心人，白首不相离!!!(对彼此必须坦诚专一.纵然被说单纯幼稚.可我还是深深地明白我只需要携手走过一生的Mr.right.简简单单.快快乐乐.我便足矣!)",0,1,1,0,1,swallow86,无,正在恋爱中,无神论/随和/早起鸟/身材苗条/厨艺不错/看重感觉,,苗条,48,彼此相依相偎,,,能做几样可口的小菜,未婚,未婚,不限,无神论,老大,江西南昌,看各自闲忙，协商分担,虎,偶尔加班,性格，心灵,25~30岁,记者型,时机成熟时就结婚,,广东省,,不限,"中文(普通话),英语",天秤座,不吸，很反感,不喝酒,想,"2000以下,4000-5000,7000-10000,15000-20000,30000-50000",2000-5000,没有,旅游结婚，不大操大办,,,汉族,,,父母健在,,早睡早起,,贸易/采购,,",与父母同住,需要时购置,已购房(无贷款),住单位房,住亲朋家",,170~182厘米
53175654,32,河北,河北石家庄,0,本科,女,168,我出生成长在温馨的家庭，被父母从小疼爱着，有些任性但不矫情，是一个开朗，脸上总有浅浅的微笑，感情丰富的人，很容易被电视剧请所打动。在大连读的大学，即将毕业。我的他，希望是个能包容我，有责任心的人，我觉得两个人走在一起，需要勇气，长久的走下去，需要彼此更多的体谅和宽容。恋爱这两个字并不是那么简单的。我不希望只是瞬间的心动，像灿烂缤纷的夏日花火美丽，却稍纵即逝。而是在理智的剖析对方之后决定再苦也不放开对方的手，一起走到路的尽头。喜欢结交朋友，愿意与你分享我的快乐！,0,0,0,0,0,靠近我，温暖你,有,已经结婚了,在校生/无神论/身材匀称,与父母同住,匀称,54,,,商业/贸易,,已婚,未婚,不限,无神论,,河北石家庄,,牛,,,24~28岁,主人型,,,河北省,,不限,,射手座,不吸烟，但不反感,不喝酒,还没想好,4000-5000,2000以下,没有,,,,汉族,,,,,,7,在校学生,O型,",与父母同住,需要时购置,已购房(无贷款),住单位房,住亲朋家",,178~185厘米
5293473,36,上海,上海黄浦,0,本科,女,164,条件一要懂得会逗我笑条件二要懂得珍惜我的好条件三要偶尔像小孩撒娇条件四没有接受不了的嗜好条件五个性不能够太胆小条件六要记得准时把我喂饱条件七要懂得尊师重道条件八要懂得适度的讨好条件九偶尔浪漫会增加情调条件十脾气不能太暴躁条件十一血型星座要当做参考射手座的要先OUTAB血型最难搞,0,0,0,0,0,samlina,有,已经结婚了,自信/身材丰满/无神论,与父母同住,丰满,65,,,计算机/网络,,已婚,未婚,不限,无神论,,江西九江,,鸡,,,26~33岁,照顾者型,,,上海市,,不限,,魔羯座,不吸烟，但不反感,兴致时小酌,还没想好,"4000-5000,7000-10000,15000-20000,30000-50000",2000-5000,没有,,,,汉族,,,,,,8,其它,A型,"需要时购置,已购房(无贷款),住单位房",,170~185厘米
56889073,29,江苏,江苏南通,1,本科,女,165,一切只是为了等待正确的他出现在我的生命中~~期待对的他出现在我的生命里~~,0,0,1,0,0,雨佳,有,正在恋爱中,无神论,,,,,,,,未婚,未婚,不限,无神论,,,,蛇,,,21~24岁,主人型,,,江苏省,,不限,,白羊座,不吸烟，但不反感,不喝酒,,4000-5000,2000-5000,没有,,,,汉族,,,,,,,其它,,,,178~180厘米
58856950,93,江苏,江苏镇江,1,初中,女,144,几年的漂泊，历尽千辛万苦。累了，倦了，无人知晓。多想有个人能够安抚，多想有个家能让心靠岸。最近工作比较忙，非诚勿扰！,0,0,1,0,0,水中月,有,已经结婚了,看重感觉/工作轻松/无神论/早起鸟/有上进心/随和,与父母同住,,53,共赴浪漫之旅,私营企业,食品业,不太会，但愿为心爱的人学习,已婚,不限,不限,无神论,老大,江苏镇江,看各自闲忙，协商分担,鼠,轻松稳定,性格，心灵,43~55岁,公务员型,时机成熟时就结婚,,黑龙江省,生物类,不限,中文(普通话),魔羯座,不吸，很反感,不喝酒,还没想好,"4000-5000,7000-10000",2000以下,有，和我住一起,简单就好，无所谓,,,汉族,,,父亲健在,,早睡早起,1,其它,A型,已购房(无贷款),,170~179厘米
65108412,30,辽宁,辽宁阜新,2,大专,女,163,大家好，我是一个感性，善良的女孩。我平时的业余时间喜欢看书，看电影，我理想中的约会方式是一起看电影，一起做饭，牵手漫步在公园，彼此相依相偎，希望将来过一起为小家奋斗，安定、温馨的生活。对于我的另一半，我希望他是一个有责任心，体贴的男士……希望在百合网能找到牵手一辈子的他。,0,1,0,0,1,玲玲,有,正在恋爱中,有上进心/早起鸟/看重感觉/无神论/随和,与父母同住,,,彼此相依相偎,,,不太会，但愿为心爱的人学习,未婚,未婚,不限,无神论,独生子女,辽宁阜新,看各自闲忙，协商分担,龙,,性格，心灵,24~30岁,哲学家型,时机成熟时就结婚,,辽宁省,医学类,不限,中文(普通话),双鱼座,不吸，很反感,社交需要喝,视情况而定,"2000以下,4000-5000,7000-10000,15000-20000,30000-50000",2000以下,没有,户外婚礼，温馨浪漫,,石家庄医学高等专科学校,汉族,,,父母健在,,早睡早起,,其它,AB型,"需要时购置,已购房(无贷款)",,173~180厘米
50173165,35,甘肃,甘肃兰州,3,本科,女,170,世界上有两个我，一个假装快乐，一个真心难过。感情是可遇不可求的，真心的祈祷自己能有个家，不要它多么奢华，只要让我有安全感，让彼此觉得温暖就足以。不奢望轰轰烈烈的爱情，经历过一次婚姻，思想和感情，经过时间的沉淀与积累，也逐渐让自己变的成熟和懂事。对于今后的那个他，没有特别的要求，只需要有责任感，懂得家的概念，懂的相互的理解和包容。两个人在一起努力经营一个家。生活是很平淡和繁琐的，能有足够的经验和耐心，面对生活中的平淡琐碎。说简单的，就是找个伴。陪伴自己走完以后的路，踏踏实实，平平淡淡。,0,1,1,0,1,女人茶,有,,高个子/无神论/身材丰满,与父母同住,丰满,63,,,邮电通信,,离异,"离异,丧偶",不限,无神论,独生子女,甘肃兰州,,猪,,,35~55岁,表演者型,,,甘肃省,,不限,中文(普通话),巨蟹座,烟不离手,不喝酒,想,"4000-5000,7000-10000,15000-20000,30000-50000",2000-5000,没有,,,中原工学院,汉族,,,父亲健在,,,7,生产/营运,AB型,已购房(无贷款),,175~185厘米
4167463,31,福建,福建泉州,1,本科,女,165,"本人虽长的没有倾国倾城的美貌,但有颗善良的心,个性随和,大方,尊老爱幼，内心保守且是个比较感性的女孩，由于我的职业圈子较单纯,喜欢清静、文雅而简单快乐的生活,但做事情比较原则，不敢称才女,但文艺较好,相信缘分会让我遇到一个聪慧睿智,为人积极向上、性格稳重、体贴伴侣，身高175以上,长相与我般配足以,本人要找的是老公不是玩伴,不合格者请误扰。谢谢合作!还有退过票的我没兴趣请多谢理解.宁缺毋滥。人要站得高，看得远。-----期待着你的眼光能看到遥远的我.",0,0,1,0,0,贵族之约,无,已经结婚了,自信/有上进心/随和/工作轻松/看重感觉/有神论,,高挑,47,彼此相依相偎,事业单位,科研/教育,不太会，但愿为心爱的人学习,已婚,未婚,不限,佛教,老五,福建泉州,看各自闲忙，协商分担,兔,轻松稳定,性格，心灵,25~32岁,领袖型,时机成熟时就结婚,,福建省,教育类,不限,中文(普通话),狮子座,不吸，很反感,不喝酒,想,"7000-10000,15000-20000",2000-5000,没有,中式婚礼，宴请宾客,,,汉族,,,父母健在,,偶尔懒散,8,教育/培训,B型,",与父母同住,已购房(无贷款),住单位房",未购车,175~185厘米
53133266,31,山东,山东济南,1,初中,女,167,普普通通一个人,0,0,1,0,0,忆馨,有,已经结婚了,自信/有神论/销售员/身材匀称/有房,已购房(有贷款),匀称,56,,,计算机/网络,,已婚,未婚,不限,基督教,,山东聊城,,兔,,,21~25岁,公务员型,,,山东省,,不限,,水瓶座,不吸烟，但不反感,不喝酒,还没想好,"2000以下,4000-5000,7000-10000,15000-20000,30000-50000",2000-5000,没有,,,,汉族,,,,,,8,销售,O型,",与父母同住,需要时购置,已购房(无贷款),住单位房,住亲朋家",,172~180厘米
20010297,32,山东,山东济南,1,本科,女,165,"外表冷酷内心狂热,外表高傲内心自卑,外表玩世不恭,内心及其细腻.是个双面人,期待友情和爱情而又害怕被伤害,向往纯真浪漫而又不能不向现实折腰。我的理想对象年龄必须在30岁以上，成熟稳重，事业必须已经小有成就，有房有车，月薪5000以上，必须懂得照顾人疼惜人。我要找的另一半是能实现我的梦想的ta,达不到条件的男士就请绕道吧，不要耽误彼此的时间！",0,0,1,0,0,芭蕾舞者,有,,无神论/身材苗条/自信,与父母同住,苗条,45,,,文化/娱乐/体育,,未婚,不限,不限,无神论,,山东济南,,牛,,,30~45岁,作家型,,,山东省,,不限,,魔羯座,不吸烟，但不反感,兴致时小酌,还没想好,"7000-10000,15000-20000,30000-50000",2000-5000,没有,,,,汉族,,,,,,9,其它,O型,"已购房(无贷款),住单位房",,174~182厘米
70847037,30,山东,山东济南,3,大专,女,172,傻傻的感性女人、只想拥有平平淡淡真真切切的感情,0,1,1,0,1,李小沫,有,正在恋爱中,有神论/有上进心/高个子/随和/身材高挑/看重感觉,与父母同住,高挑,54,共赴浪漫之旅,私营企业,科研/教育,不太会，但愿为心爱的人学习,未婚,未婚,不限,其它,独生子女,山东济南,一起分工合作,兔,,性格，心灵,23~33岁,表演者型,时机成熟时就结婚,,山东省,教育类,不限,中文(普通话),天秤座,不吸，很反感,社交需要喝,视情况而定,7000-10000,2000-5000,没有,中式婚礼，宴请宾客,,济南大学,汉族,,,父母健在,,偶尔熬夜,7,其它,AB型,已购房(无贷款),,180~190厘米
