56595533,34,福建,福建泉州,1,本科,男,176,"这些年打拼事业，感情上成了空白。希望有爱一起走。人世间有百媚千红，我不知道我爱哪一种。只是因为只有相爱才能让我的心找到港口可以停泊。我想说,我不是来交朋友的,我是奔着结婚来的...",0,0,1,0,0,兲芐忲岼,有,,有房/有神论/自信/身材匀称,已购房(无贷款),匀称,65,,,房地产建筑业,,未婚,未婚,不限,佛教,,,,鼠,,,21~27岁,公务员型,,,福建省,,不限,,巨蟹座,不吸烟，但不反感,兴致时小酌,想,"4000-5000,7000-10000,15000-20000,30000-50000",5000-10000,没有,,,,汉族,,,,,,8,其它,B型,"与父母同住,已购房(无贷款),住单位房",,158~170厘米
50329208,38,北京,北京朝阳,0,硕士,男,172,做事比较有计划性，善良，独立，非常富有同情心，有时也比较细腻，体贴,0,0,0,0,0,larrylee,有,已经结婚了,自信/科研人员/高学历/无神论/身材匀称,,匀称,65,,,计算机/网络,,已婚,未婚,不限,无神论,,北京东城,,猴,,,23~27岁,照顾者型,,,北京市,,不限,,双鱼座,不吸烟，但不反感,兴致时小酌,想,"4000-5000,7000-10000,15000-20000,30000-50000",10000-20000,没有,,,北京邮电大学,汉族,,,,,,8,科研,A型,",与父母同住,需要时购置,已购房(无贷款),住单位房,住亲朋家",,155~165厘米
6438924,42,北京,北京海淀,0,硕士,男,168,本人，男，30岁，计算机应用专业硕士，身高168cm，体重58～62kg（有段时间没有称了，应该在这个范围）。不帅，不过也没有吓哭过小孩子。缺点：1.不浪漫2.不高，但还有一些运动天份3.没有音乐天份，练过笛子口琴，但K歌的时候调跑的不可救药4.没有领袖气质，手下的兄弟没大没小，吓不住他们5.工作忙，在一家把女人当男人用，把男人当牲口用的公司。不会有整天的时间陪女朋友，不过可以把不在公司的时间都留给你6.。。。。。。优点：我说得不算，你自己来发现爱好：1.乒乓球，能和专业队员拼一拼2.羽毛球，高手面前时菜鸟，菜鸟面前是高手3.所有棋类，技术一般，只下不看4.计算机，从编程到游戏5.做菜，羞于启齿，但还要诚实的讲出来6.读书，呵呵，好歹也算一个知识分子,0,0,0,0,0,secondhop,无,,高学历/无神论/自信/科研人员/身材匀称,已购房(无贷款),匀称,62,,,计算机/网络,,未婚,未婚,不限,无神论,,北京东城,,龙,,,20~28岁,艺术家型,,,北京市,,不限,,巨蟹座,不吸烟，但不反感,兴致时小酌,想,"2000以下,4000-5000,7000-10000,15000-20000,30000-50000",10000-20000,没有,,,,汉族,,,,,,8,科研,A型,",与父母同住,需要时购置,已购房(无贷款),住单位房,住亲朋家",,158~173厘米
53443179,36,辽宁,辽宁沈阳,0,本科,男,175,家庭条件一般，有房无车。本人科班出身，本科的兽医，现在是公安部一家企业的地区销售主管，本人体貌还可以，没有什么不良爱好。,0,0,1,0,0,vani2001,有,,有房/无神论/销售员,已购房(无贷款),,,,,,,未婚,未婚,不限,无神论,,,,鸡,,,21~25岁,主人型,,,辽宁省,,不限,,射手座,社交时偶尔吸烟,兴致时小酌,想,"2000以下,4000-5000,7000-10000,15000-20000,30000-50000",2000-5000,没有,,,,汉族,,,,,,,销售,,",与父母同住,需要时购置,已购房(无贷款),住单位房,住亲朋家",,160~165厘米
64575503,48,江苏,江苏南京,2,大专,男,178,我是一个工程师工作起来很少在家，我很平凡但有自己的目标和方向，希望能遇见一个自己喜欢的人。就是想找个人结婚。我的目的是因为想结婚才登陆这个平台，在这个平台上希望有你的关心和答复，我希望找的人年龄从30岁到40岁之间。每个人都过去但它已经成为昨天，请联系我的朋友别再问我为什么没有成家的问题，如果有家庭我就不用来这里啦。家是我经历了拼搏为让彼此有个属于自己的天地不在漂泊才购置的，感谢留意我的朋友也祝福你们与我一样早些找到理想之人。我希望关心我的朋友首先了解我的真实有效的个人基本资料和我基本要求，如果您经过考虑后再想想愿意和我联系再通知我，对不符合我要求的人我不会关心全部删除谢谢。非城勿扰。其实我就是个普普通通很平凡的一个男人。,0,1,0,0,1,╰ゞの┊喜┊〆o,有,已经结婚了,厨艺不错/勤快/工作轻松/有房/身材匀称,已购房(无贷款),匀称,63,一起做饭,私营企业,商业/贸易,能做几样可口的小菜,已婚,不限,不限,其它,老二,江苏南京,任劳任怨,狗,工作时间自由,性格，心灵,30~40岁,将军型,时机成熟时就结婚,,江苏省,艺术类,不限,中文(普通话),双鱼座,社交时偶尔吸烟,不喝酒,不想,"2000以下,7000-10000,15000-20000,30000-50000",5000-10000,没有,简单就好，无所谓,,南京艺术学院,汉族,,,父母健在,,偶尔懒散,10,工程/能源,O型,"与父母同住,需要时购置,住单位房,住亲朋家",需要时购置,165~170厘米
50194432,36,北京,北京海淀,4,本科,男,178,我29岁，有房，有车但是这跟找朋友没有关系，因为我同样也有家庭。“你是不是，疯了！”我没疯，我是一个阳光、帅气的人，我是一个穿着整齐，甚至有点整理癖的人。我在北京奋斗7年现在有一个让人羡慕的家庭，还有一份看似很有前途的职业。但是我没有朋友，7年的奋斗中我醉心于工作，陪伴我的只有从大学就和我在一起的女朋友。也许是爱情淡化，也许是工作不再需要我付出所有的精力，我现在感到孤独，因为我在北京没有朋友。那帮所谓的哥们只会陪我喝酒、唱歌、泡酒吧。我不是一个对家庭不忠的人，但是我不能除了老婆没有别的朋友，我也不是一个对哥们不忠的人，应为每次哥们的要求我都会答应。但是我现在发现我太需要一些异性朋友了，我希望有人能陪我安静的在咖啡厅里聊天，我希望有人能陪我一起看完一部文艺片，我希望有人和我泡酒吧时说少喝点喝酒解决不了烦恼......不要认为我是在找婚外情或者一夜情，你们错了，能理解我的心情的有缘人让我们交个朋友吧,1,1,1,0,1,好奇害死猫,有,已经结婚了,自信/有房/有神论/销售员/身材健壮,已购房(无贷款),健壮,75,,,房地产建筑业,,已婚,不限,不限,天主教,,北京昌平,,鸡,,,20~30岁,公务员型,,,北京市,,不限,,狮子座,社交时偶尔吸烟,酒不离口,不想,"2000以下,4000-5000,7000-10000,15000-20000,30000-50000",5000-10000,有，和我住一起,,,北京建筑工程学院,汉族,,,,,,8,销售,B型,",与父母同住,需要时购置,已购房(无贷款),住单位房,住亲朋家",,160~175厘米
56326155,30,福建,福建南平,0,大专,男,170,简简单单就是我希望碰到那个有缘的你,0,0,1,0,0,斌,有,,无神论/厨艺不错/想结婚/随和,租房,,,牵手漫步在公园,,,能做几样可口的小菜,未婚,未婚,不限,无神论,老二,江西鹰潭,一起分工合作,兔,,性格，心灵,18~24岁,艺术家型,一年以内,,江西省,,不限,中文(普通话),射手座,不吸烟，但不反感,社交需要喝,想,"2000以下,4000-5000,7000-10000,15000-20000,30000-50000",2000-5000,没有,中式婚礼，宴请宾客,,,汉族,,,父母健在,,偶尔熬夜,,其它,,",与父母同住,需要时购置,已购房(无贷款),住单位房,住亲朋家",,155~170厘米
57525620,36,江苏,江苏南京,4,大专,男,172,我的性格特点是：不想单身的我，希望能遇见真诚的你！想结婚，但不是为了结婚而结婚！我想的我的婚姻幸福！结婚说白了，就是两个人的心在一起了！非诚勿扰！谢谢！本人看不了信息本人是司机,0,1,1,0,1,烟圈,有,,厨艺不错/早起鸟/工作狂/身材匀称/名校,租房,匀称,67,一起打游戏或者一起看电影,私营企业,房地产建筑业,能做几样可口的小菜,未婚,未婚,不限,佛教,独生子女,山东枣庄,看各自闲忙，协商分担,鸡,经常出差,性格，心灵,20~33岁,学者型,时机成熟时就结婚,,江苏省,金融学类,不限,中文(普通话),天蝎座,烟不离手,不喝酒,想,"2000以下,4000-5000,7000-10000,15000-20000,30000-50000",5000-10000,没有,中式婚礼，宴请宾客,,南航,汉族,,,父母健在,,早睡早起,3,其它,O型,",与父母同住,需要时购置,已购房(无贷款),住单位房,住亲朋家",单位用车,160~166厘米
56468414,34,河北,河北唐山,1,本科,男,180,.............,0,0,1,0,0,人,有,已经结婚了,高个子/有房/无神论/身材苗条,已购房(无贷款),较瘦,,,,政府机关,,已婚,未婚,不限,无神论,,,,猪,,,23~28岁,将军型,,,河北省,,不限,,魔羯座,烟不离手,兴致时小酌,想,"2000以下,4000-5000,7000-10000,15000-20000,30000-50000",2000-5000,没有,,,,汉族,,,,,,6,其它,A型,",与父母同住,需要时购置,已购房(无贷款),住单位房,住亲朋家",,162~168厘米
66377031,27,湖南,湖南长沙,3,本科,男,175,大家好，我是一个有责任心，稳重，体贴的男孩，现在常住地点在湖南长沙，我理想中的约会方式是牵手漫步在公园，对于我的另一半，我希望她是一个孝顺的女生……希望在百合网能快点遇到心仪的她。,0,1,0,0,1,天使在唱歌,有,已经结婚了,销售员/接受闪婚/随和/无神论/厨艺不错,租房,匀称,60,牵手漫步在公园,私营企业,其它,能做几样可口的小菜,已婚,不限,不限,无神论,,湖南长沙,一起分工合作,马,偶尔加班,性格，心灵,18~21岁,照顾者型,及时闪婚,,湖南省,管理类,不限,"中文(普通话),英语",处女座,社交时偶尔吸烟,不喝酒,想,"2000以下,4000-5000,7000-10000,15000-20000,30000-50000",2000-5000,没有,户外婚礼，温馨浪漫,,长沙理工,汉族,,,父母健在,,偶尔熬夜,5,销售,A型,",与父母同住,需要时购置,已购房(无贷款),住单位房,住亲朋家",需要时购置,155~175厘米
50087616,50,安徽,安徽合肥,2,本科,男,176,大千世界茫茫人海，伊人在何处？...........,0,1,0,0,1,lw,无,,身材健壮/有神论/有房,已购房(有贷款),健壮,78,,,其它,,离异,不限,不限,其它,,安徽宿州,,猴,,,29~39岁,冒险家型,,,安徽省,,不限,中文(普通话),巨蟹座,社交时偶尔吸烟,不喝酒,想,"2000以下,4000-5000,7000-10000,15000-20000,30000-50000",2000以下,没有,,,,汉族,,,,,,7,技工,其它,",与父母同住,需要时购置,已购房(无贷款),住单位房,住亲朋家",,155~172厘米
50259705,44,外国,外国,2,本科,男,166,本人祖籍成都，重庆长大，父母是高级知识分子家庭。A型血，双子座，多年的独立生活，练就了我热心、开朗、乐观、积极的性格。本人移居加拿大温哥华几年了，目前在温哥华从事物流和贸易工作，收入稳定，水平在当地属中上。生活中的挫折没有让我跌倒，对爱情和真爱的执着让我对明天充满着希望。如果我是那种随随便便的人，就没有必要到这样的严肃网站上来交友征婚了。未来的你，不一定美若天仙，不一定小家碧玉，不一定大家闺秀[再说了，我也没有那条件和奢望]只要你和我感觉投缘就行。希望能找到性格相投，重家庭，重感情，爱小孩的女子为我的终生伴侣，平平淡淡过日子，将来一起在加拿大定居生活。如果你就是这样一位身心健康，活泼开朗，动中带静的女孩，那就和我联系吧，缘分就在那一瞬间。如果在未来一两年内没有打算结婚的女孩，以及在未来的婚姻家庭生活中，不喜欢或者是从不打算要小孩子的女孩就不用浪费时间联系了。我的扣扣号码，具体的号码查看我的毕业学校名称，里面就是啦。,0,1,1,0,1,西蒙,有,正在恋爱中,高管/身材匀称/有房/有神论,已购房(有贷款),匀称,59,,,商业/贸易,,未婚,不限,不限,信神但未定教,,重庆渝中,,虎,,,20~30岁,教师型,,,加拿大,,不限,,双子座,不吸烟，但不反感,兴致时小酌,想,"2000以下,4000-5000,7000-10000,15000-20000,30000-50000",2000-5000,没有,,,,汉族,,,,,,5,高级经营管理,A型,",与父母同住,需要时购置,已购房(无贷款),住单位房,住亲朋家",,158~165厘米
53065758,45,北京,北京昌平,3,高中,男,173,茫茫人海，细细寻觅；激情渐渐变弱，寻找平等互爱的想法反而更加明显。。。。。。,0,1,1,0,1,乘凉树,无,已经结婚了,高管/自信/无神论/身材健壮,需要时购置,健壮,65,,,公关/广告,,已婚,未婚,不限,无神论,,山东德州,,牛,,,29~34岁,照顾者型,,,北京市,,不限,,金牛座,不吸烟，但不反感,不喝酒,想,"2000以下,4000-5000,7000-10000,15000-20000,30000-50000",2000-5000,没有,,,,汉族,,,,,,10,高级经营管理,O型,",需要时购置,住单位房,住亲朋家",,153~168厘米
53374856,41,江苏,江苏扬州,0,本科,男,172,在大海航行的轮船他需要的是一个环境优良的港湾，同样我也需要一个温馨和谐的家，谁能与我牵手共度人生，建立一个温馨和谐,0,0,1,0,0,大海,无,正在恋爱中,身材健壮/警察/无神论/自信,,健壮,66,,,,,离异,不限,不限,无神论,,江苏扬州,,龙,,,25~31岁,主人型,,,江苏省,,不限,,魔羯座,,,想,"2000以下,4000-5000,7000-10000,15000-20000,30000-50000",,有，和我住一起,,,,汉族,,,,,,9,,B型,",与父母同住,需要时购置,已购房(无贷款),住单位房,住亲朋家",,159~170厘米
50686929,40,江西,江西南昌,2,本科,男,183,你不必知道“同心而离居，忧伤以终老”这首诗的开头一句是什么；我有时会整点这样的忧伤的小句子叨唠叨唠，并不代表我的心情。“醉笑陪君三万场，不诉离伤”，这个句子你喜欢不喜欢？你不必陪着我看NBA，你若喜欢周杰伦，我会哼上几句“菊花台”。你不必在我打篮球的时候无聊的坐在场边。你只需要偶尔给我一个拥抱的表情，我便温暖。你不必知道网游或者摩托车改装，到底是怎样的玩艺。我告诉你，那些都很烧钱。你若喜欢，我努力带你一起玩。你可以不看我写的那些唬人的文字，你看你的电视，我写我的文字就好了。我有一份很喜欢的工作，有时会抽烟，但不必喝酒，对着电脑就可以搞定的工作。尽管我不很热爱这个城市，但我想一直在南昌生活下去。如果你需要知道我的身高体重长相，说话的声音，见到我就知道了。,0,1,1,0,1,御宅,有,正在恋爱中,身材高挑/无神论/高个子/高管,,高挑,70,,,公关/广告,,未婚,未婚,不限,无神论,,上海普陀,,马,,,23~29岁,艺术家型,,,江西省,,不限,,水瓶座,社交时偶尔吸烟,兴致时小酌,想,"2000以下,4000-5000,7000-10000,15000-20000,30000-50000",2000-5000,没有,,,江西师大,汉族,,,,,,7,高级经营管理,O型,",与父母同住,需要时购置,已购房(无贷款),住单位房,住亲朋家",,158~170厘米
54763337,56,河南,河南开封,2,大专,男,183,一个人走得久了，会累，有个人，陪你在冬日的午后晒太阳，为你递上一杯热气腾腾的绿茶，和心爱的人慢慢变老，还有什么比这更幸福呢？,0,1,1,0,1,xiange,无,已经结婚了,身材匀称/无神论/医护人员/高个子/有车,已购房(无贷款),匀称,86,,事业单位,健康/医疗,,已婚,"离异,丧偶",不限,无神论,,河南开封,,虎,工作时间自由,,30~45岁,将军型,,,河南省,医学类,不限,"中文(普通话),英语",巨蟹座,社交时偶尔吸烟,兴致时小酌,还没想好,2000以下,5000-10000,有，不和我住一起,,,河南省其他,汉族,,,,,,6,医院/医疗/护理,B型,",与父母同住,需要时购置,已购房(无贷款),住单位房,住亲朋家",已购车,163~175厘米
3130502,40,上海,上海长宁,0,高中,男,151,i9jui9j,0,0,0,0,0,leizh00,无,正在恋爱中,自信/有神论,,丰满,80,,,,,未婚,未婚,不限,印度教,,西藏林芝,,蛇,,,22~27岁,照顾者型,,,上海市,,不限,,狮子座,,,不想,"2000以下,4000-5000,7000-10000,15000-20000,30000-50000",,没有,,,,汉族,,,,,,8,,O型,",与父母同住,需要时购置,已购房(无贷款),住单位房,住亲朋家",,158~167厘米
64304160,34,福建,福建三明,4,中专/职高/技校,男,170,我要的爱是平平淡淡，生活中的点滴快乐都能让我感到很幸福！在情感的路上，我痛过，哭过。我更知道该怎么去珍惜彼此间的感情。有的时候我常常在想，每天下班回去，有个人在家里等着自己，一起下厨，一起打扫卫生，没事的时候打打闹闹，一块坐在沙发上磕着瓜子，看着自己喜欢电视节目，那是多么幸福的事！现在的我玩不起情感游戏。只是想踏踏实实的找一个人陪着，一个值得我去守候的人。我只想找一个能真正适合的，能和我一起孝顺父母，能和我牵手走完人生的女孩。,0,1,1,0,1,知足常乐,有,,无神论/随和/身材苗条/想结婚/工作轻松,租房,较瘦,62,牵手漫步在公园,私营企业,食品业,能做几样可口的小菜,已婚,未婚,不限,无神论,老二,福建南平,看各自闲忙，协商分担,鼠,轻松稳定,性格，心灵,26~29岁,领袖型,一年以内,,福建省,,不限,中文(普通话),双鱼座,社交时偶尔吸烟,兴致时小酌,想,"2000以下,4000-5000,7000-10000,15000-20000,30000-50000",2000-5000,没有,中式婚礼，宴请宾客,,福建省其他,汉族,,,父母健在,,偶尔熬夜,2,行政/后勤,B型,,未购车,150~160厘米
50070691,38,四川,四川成都,3,本科,男,178,一个月之差，使我与“70后”和“80后”的定义无关。轻轻年纪，也历经了“大起大落”，处事着大局，珍惜当下，也规划长远。生活上“健康、自然、人文”，基本不抽烟，较少喝酒。读书广泛，尤以金融投资为重。热爱大自然，喜欢旅行，登山涉水，8848没有胆量挑战，但是5350米已经成功留下自己的足迹。性格内敛，待人平和、宽容、真诚。身高177，肥瘦适中。具备人类独有的双面性格，但是待人却总是真诚。,0,1,1,0,1,丑狗狗,有,正在恋爱中,高管/自信/身材匀称/无神论,需要时购置,匀称,65,,,金融/证券/保险,,未婚,未婚,不限,无神论,,四川成都,,羊,,,20~28岁,哲学家型,,,四川省,,不限,,天蝎座,不吸烟，但不反感,兴致时小酌,还没想好,"2000以下,4000-5000,7000-10000,15000-20000,30000-50000",2000-5000,没有,,,,汉族,,,,,,8,高级经营管理,其它,",与父母同住,需要时购置,已购房(无贷款),住单位房,住亲朋家",,150~180厘米
4139294,34,天津,天津塘沽,1,本科,男,184,波斯有一则传说，每当玫瑰花开时，夜莺就开始歌唱，对它倾诉爱意，直至力竭声嘶，痴醉于玫瑰的芳香，随即倒落于玫瑰树枝下。当夜莺知道玫瑰被阿拉真神封为花之女王时，它非常高兴，因而向吐露芬芳的玫瑰飞了过去，就在它靠近玫瑰时，玫瑰的刺刚好刺中它的胸口，鲜红的血将花瓣染成红色。如今波斯人仍然相信，每当夜莺彻夜啼叫，就是红玫瑰花开的时候。,0,0,0,0,1,已婚男人,无,已经结婚了,无神论/高个子/身材苗条,,较瘦,72,,,,,已婚,未婚,不限,无神论,,山西临汾,,猪,,,20~26岁,作家型,,,天津市,,不限,,天蝎座,,,想,"2000以下,4000-5000,7000-10000,15000-20000,30000-50000",,没有,,,,汉族,,,,,,6,,B型,",与父母同住,需要时购置,已购房(无贷款),住单位房,住亲朋家",,167~179厘米
60222368,31,天津,天津河北,4,本科,男,182,我的性格特点是：开朗健谈。业余时间我喜欢：听相声~说相声。我憧憬的生活是：和谐美满。,0,1,1,0,1,chaihua,有,已经结婚了,随和/金融才俊/有车/早起鸟/高个子,已购房(无贷款),较胖,95,,,金融/证券/保险,能做几样可口的小菜,已婚,未婚,不限,,独生子女,,一起分工合作,兔,,,20~24岁,将军型,,,天津市,,不限,中文(普通话),水瓶座,不吸，很反感,社交需要喝,,"2000以下,4000-5000,7000-10000,15000-20000,30000-50000",10000-20000,没有,,,天津财经,,,,父母健在,,早睡早起,6,证券/金融/投资/银行,A型,",与父母同住,需要时购置,已购房(无贷款),住单位房,住亲朋家",已购车,160~175厘米
64350183,31,山东,山东潍坊,3,大专,男,176,我的性格开朗，富有激情，做事严谨，富有斗志！敢于挑战不服输，自信但不张狂！；业余时间我喜欢和朋友在一起，看军事刊物，摄影。；我憧憬的生活是工作顺利，爱情幸福，生活平淡但富有情调，全家健健康康，快快乐乐！；我希望我爱的人能够和我同甘苦共患难，互相体贴，互相谅解，有事多交流，生活中有些小情调，活泼但不蛮横！善良，不势力！；此外我还想补充我想找一个真正能和我相爱，并牵手走过风风雨雨最后白头到老的女孩，如果你感觉我合适就联系我吧。。,0,1,1,0,1,亮子,有,已经结婚了,身材匀称/有房/有神论/厨艺不错/勤快,已购房(有贷款),匀称,65,共赴浪漫之旅,上市公司,营销/市场/策划,色香味俱全,已婚,"未婚,离异",不限,基督教,老大,山东济宁,任劳任怨,兔,,性格，心灵,20~28岁,表演者型,时机成熟时就结婚,,山东省,市场营销类,不限,中文(普通话),巨蟹座,不吸烟，但不反感,社交需要喝,想,"2000以下,4000-5000,7000-10000,15000-20000,30000-50000",2000-5000,没有,户外婚礼，温馨浪漫,,,汉族,,,父母健在,,偶尔熬夜,7,市场/公关,B型,",与父母同住,需要时购置,已购房(无贷款),住单位房,住亲朋家",需要时购置,156~170厘米
54228659,34,北京,北京丰台,1,硕士,男,175,发,0,0,1,0,0,CAll,无,,自信/法务人员/有房/身材健壮/高学历,已购房(无贷款),健壮,78,,,法律/司法,,未婚,未婚,不限,无神论,,黑龙江齐齐哈尔,,鼠,,,22~25岁,将军型,,,北京市,,不限,,白羊座,不吸烟，但不反感,兴致时小酌,想,"2000以下,4000-5000,7000-10000,15000-20000,30000-50000",5000-10000,没有,,,,汉族,,,,,,8,律师/法务/合规,A型,",与父母同住,需要时购置,已购房(无贷款),住单位房,住亲朋家",,157~165厘米
54393796,67,江苏,江苏无锡,0,本科,男,178,我这张早已过期的船票，能否登上你的航程。。。加我。（发+发）。（发）。(咪+发）。（多），（索）。（发）。(来）。（发+索）。（发+发）,0,0,1,0,0,爱的守候,无,已经结婚了,无神论/身材匀称,,匀称,75,,,文化/娱乐/体育,,已婚,不限,不限,无神论,,江苏宿迁,,虎,,,30~48岁,记者型,,,江苏省,,不限,,魔羯座,烟不离手,不喝酒,想,"2000以下,4000-5000,7000-10000,15000-20000,30000-50000",5000-10000,有，不和我住一起,,,,汉族,,,,,,5,艺术/设计/创意,其它,",与父母同住,需要时购置,已购房(无贷款),住单位房,住亲朋家",,158~170厘米
83922423,28,江苏,江苏苏州,0,高中,男,173,大家好，我是一个幽默的男孩，现在常住地点在江苏省苏州市，我平时的业余时间喜欢运动，我在私营企业工作，我想时机成熟就结婚，我理想中的约会方式是牵手漫步在公园，对于我的另一半，我希望她是一个孝顺，顾家的女生……希望在百合网能快点遇到心仪的她。,0,0,0,0,0,大表哥,有,,无神论,,,,,,,,未婚,未婚,不限,无神论,,,,蛇,,,18~22岁,,,,江苏省,,不限,,射手座,不吸烟，但不反感,不喝酒,,"2000以下,4000-5000,7000-10000,15000-20000,30000-50000",2000-5000,没有,,,,汉族,,,,,,,其它,,",与父母同住,需要时购置,已购房(无贷款),住单位房,住亲朋家",,165~170厘米
7090557,51,湖北,湖北襄樊,0,本科,男,184,爱情是两个人的事情，两个完全平等的、有独立人格的人的事情。你可以努力，但不是说，你努力了就一定会有效果，因为另一个人，你并不能左右。,0,0,0,0,0,bin_x888,有,已经结婚了,高个子/有房/法务人员/无神论,已购房(无贷款),,,,,法律/司法,,已婚,未婚,不限,无神论,,,,羊,,,25~32岁,冒险家型,,,湖北省,,不限,,白羊座,社交时偶尔吸烟,兴致时小酌,还没想好,"2000以下,4000-5000,7000-10000,15000-20000,30000-50000",2000-5000,有，和我住一起,,,,汉族,,,,,,,律师/法务/合规,,",与父母同住,需要时购置,已购房(无贷款),住单位房,住亲朋家",,160~175厘米
7542122,34,江苏,江苏苏州,0,本科,男,172,有缘!,0,0,0,0,0,振宇,有,已经结婚了,销售员/无神论/身材苗条,需要时购置,较瘦,56,,,营销/市场/策划,,已婚,未婚,不限,无神论,,江苏盐城,,猪,,,20~24岁,教师型,,,江苏省,,不限,,射手座,社交时偶尔吸烟,兴致时小酌,想,4000-5000,2000-5000,没有,,,,汉族,,,,,,7,销售,O型,",与父母同住,需要时购置,已购房(无贷款),住单位房,住亲朋家",,158~166厘米
6063697,39,北京,北京朝阳,0,本科,男,173,人海茫茫，何处是家，有爱就有家,0,0,0,0,0,阿牛,有,已经结婚了,无神论/身材苗条/有房/自信,已购房(无贷款),较瘦,60,,,计算机/网络,,已婚,未婚,不限,无神论,,北京东城,,马,,,20~27岁,作家型,,,北京市,,不限,,天秤座,不吸烟，但不反感,兴致时小酌,还没想好,"2000以下,4000-5000,7000-10000,15000-20000,30000-50000",5000-10000,没有,,,,汉族,,,,,,8,其它,O型,",与父母同住,需要时购置,已购房(无贷款),住单位房,住亲朋家",,160~173厘米
