53101533,35,北京,北京东城,0,本科,男,178,男大当婚，女大当嫁。大学毕业一年了~！北京人。现在在机关工作，压力不算大。收入还算够花~！愿找个心地善良~热爱生活~！最好是北京人·~孝敬父母~的女孩~,0,0,0,0,0,碧海晴空,有,已经结婚了,公务员/无神论,,,,,,,,已婚,未婚,不限,无神论,,,,猪,,,21~25岁,将军型,,,北京市,,不限,,白羊座,不吸烟，但不反感,不喝酒,想,4000-5000,2000-5000,没有,,,,汉族,,,,,,,公务员,,",与父母同住,需要时购置,已购房(无贷款),住单位房,住亲朋家",,161~170厘米
53725461,34,广东,广东深圳,2,硕士,女,158,本人文静，乐观，热爱生活。虽然还有半年才硕士毕业，可是看看日历就知道年纪不小了！天天被家里催，也不好意思再剩着了。想找一个靠谱的男人，可以幸福地牵着他的手手，共建一个爱的小家，彼此珍惜，相扶一生！————很幸福、很幸运地，我在这里找到了他！快到七夕了，希望我和他能够幸福地牵着彼此的手，就这样相互依偎着一辈子走下去！亲爱的，七夕快乐~也祝百合网的XDJM们早日找到自己的幸福！,0,1,0,0,1,悦儿,有,已经结婚了,在校生/高学历/自信/身材丰满/无神论,需要时购置,丰满,60,,,房地产建筑业,,已婚,未婚,不限,无神论,,河北张家口,,鼠,,,25~29岁,专家型,,,广东省,,不限,中文(普通话),白羊座,不吸烟，但不反感,不喝酒,想,"2000以下,4000-5000,7000-10000,15000-20000,30000-50000",2000以下,没有,,,,汉族,,,,,,8,在校学生,O型,",与父母同住,需要时购置,已购房(无贷款),住单位房,住亲朋家",,168~180厘米
50579218,29,云南,云南昆明,0,本科,女,168,对不起，请各位能认真看我对另一半的要求，否则浪费您的时间实在是罪过。简单随性喜欢平凡的生活喜欢小动物乐观主义,0,0,0,0,0,yueya,有,正在约会中,无神论,,,,,,传媒/出版,,未婚,"未婚,离异",不限,无神论,,,,龙,,,25~40岁,艺术家型,,,云南省,,不限,,狮子座,不吸烟，但不反感,不喝酒,想,"4000-5000,7000-10000,15000-20000,30000-50000",2000-5000,没有,,,,汉族,,,,,,,艺术/设计/创意,,"已购房(无贷款),住单位房",,175~190厘米
75000021,26,广东,广东清远,2,中专/职高/技校,女,165,大家好，通过百合网我找到了心仪的他，并和他结为夫妻，孕育了我们的爱情结晶。希望这一生能跟他十指相扣走下去，你们也会很快找到那个可以陪伴你们一生的人，加油,0,1,0,0,1,陆陆,有,已经结婚了,无神论/厨艺不错/医护人员/工作忙碌/看重感觉/随和,,较胖,62,彼此相依相偎,,,能做几样可口的小菜,已婚,未婚,不限,无神论,老三,广东清远,看各自闲忙，协商分担,猴,偶尔加班,性格，心灵,22~27岁,表演者型,时机成熟时就结婚,,广东省,医学类,不限,中文(普通话),白羊座,不吸，很反感,社交需要喝,视情况而定,4000-5000,2000-5000,没有,户外婚礼，温馨浪漫,,,汉族,,,父母健在,,偶尔熬夜,,医院/医疗/护理,O型,",与父母同住,需要时购置,已购房(无贷款),住单位房,住亲朋家",未购车,170~190厘米
50388545,33,河北,河北石家庄,0,本科,女,156,因为爱所以爱，因为有缘才想聚！所以回来聚！,0,0,0,0,0,haihao,无,,无神论,,,,,,计算机/网络,,未婚,不限,不限,无神论,,,,鼠,,,22~24岁,艺术家型,,,河北省,,不限,,处女座,不吸烟，但不反感,兴致时小酌,还没想好,2000以下,2000以下,没有,,,,汉族,,,,,,,教育/培训,,",与父母同住,需要时购置,已购房(无贷款),住单位房,住亲朋家",,167~167厘米
53342898,32,北京,北京海淀,3,高中,女,170,我是一个生在北京长在北京的女孩，喜欢旅游和听音乐，心情好时还喜欢研究一下烹调。很欣赏那句话：一直以为还有更好的，反反复复才发觉最好的其实一直在身旁。或许很多美好的人和事都在我们身边，只是忙碌的我们始终没有发现。希望能在这里找到属于我的缘分，陪我一起欣赏生命中的美丽风景。,0,1,1,0,1,魔水晶,有,,无神论/高个子/身材高挑,与父母同住,高挑,51,,,文化/娱乐/体育,,未婚,未婚,不限,无神论,,北京海淀,,虎,,,24~35岁,学者型,,,北京市,,不限,,白羊座,不吸烟，但不反感,不喝酒,想,"4000-5000,7000-10000,15000-20000,30000-50000",2000-5000,没有,,,,汉族,,,,,,6,其它,AB型,"与父母同住,已购房(无贷款)",,174~196厘米
56016335,30,重庆,重庆永川,3,高中,女,156,"我的生活一直都是那么的平淡,因为每天都在重复地做着同样的事情,但却很安于现状,我很相信爱情,也期待会出现一个可以将我视如生命的那个他,会时时刻刻关心我,爱护我,不会凶我骂我,最大的心愿就是和我爱(爱我)的人一起相互扶持平平淡淡走完一生，非诚勿扰",0,1,1,0,1,笨笨,无,已经结婚了,无神论/身材匀称,租房,匀称,45,,,食品业,,已婚,不限,不限,无神论,,重庆璧山,,兔,,,24~27岁,艺术家型,,,重庆市,,不限,中文(普通话),魔羯座,不吸烟，但不反感,不喝酒,还没想好,"2000以下,4000-5000,7000-10000,15000-20000,30000-50000",2000以下,没有,,,,汉族,,,,,,6,财务/审计/税务,,已购房(无贷款),,170~178厘米
53869472,31,福建,福建福州,2,高中,女,170,谢谢,0,1,1,0,1,岑岑,无,正在恋爱中,高个子/身材苗条/有神论/自信,与父母同住,苗条,49,,,,,未婚,不限,不限,道教,,甘肃兰州,,虎,,,25~50岁,照顾者型,,,福建省,,不限,,狮子座,不吸烟，但不反感,兴致时小酌,还没想好,"7000-10000,15000-20000,30000-50000",2000-5000,没有,,,,汉族,,,,,,8,其它,O型,"与父母同住,已购房(无贷款)",,160~185厘米
114267,39,,,0,本科,女,165,,0,0,0,0,0,yiyuyy,无,,有神论/金融才俊,,,,,,计算机/网络,,未婚,未婚,不限,佛教,,,,羊,,,30~35岁,照顾者型,,,美国,,不限,,双子座,不吸烟，但不反感,不喝酒,想,15000-20000,2000-5000,没有,,,,汉族,,,,,,,证券/金融/投资/银行,,已购房(无贷款),,170~180厘米
56450715,31,辽宁,辽宁沈阳,0,本科,女,160,我已退出此网,0,0,1,0,0,qiqi,无,正在恋爱中,无神论,需要时购置,,,,,,,未婚,未婚,不限,无神论,,辽宁沈阳,,兔,,,24~28岁,艺术家型,,,辽宁省,,不限,,白羊座,不吸烟，但不反感,不喝酒,,"2000以下,4000-5000,7000-10000,15000-20000,30000-50000",2000以下,没有,,,,汉族,,,,,,,其它,,",与父母同住,需要时购置,已购房(无贷款),住单位房,住亲朋家",,170~185厘米
56861350,32,江西,江西赣州,0,高中,女,160,我是一个温柔，善解人意的女孩，希望找到属于我的王子,0,0,1,0,0,玲玲,有,,无神论/自信/身材苗条,与父母同住,苗条,45,,,,,未婚,未婚,不限,无神论,,,,虎,,,27~30岁,作家型,,,江西省,,不限,中文(普通话),巨蟹座,不吸烟，但不反感,不喝酒,想,"2000以下,7000-10000,15000-20000,30000-50000",2000-5000,没有,,,,汉族,,,,,,10,其它,,已购房(无贷款),,168~172厘米
50316113,31,北京,北京朝阳,0,本科,女,172,我要和我的泡泡一起度过每一个明天,0,0,0,0,0,兔子,有,已经结婚了,有神论/身材匀称/高个子,与父母同住,匀称,60,,,金融/证券/保险,,已婚,未婚,不限,其它,,北京朝阳,,兔,,,21~22岁,表演者型,,,北京市,,不限,,双子座,不吸烟，但不反感,不喝酒,还没想好,"4000-5000,7000-10000,15000-20000,30000-50000",2000以下,没有,,,,汉族,,,,,,5,生产/营运,B型,",与父母同住,需要时购置,已购房(无贷款),住单位房,住亲朋家",,178~187厘米
54107431,34,广东,广东江门,1,高中,女,164,"爱,就要付出,付出不一定要讨回,但是有时总想不到对方是想要什么?(不好意思!只是随意打出来的)",0,0,1,0,0,水汪汪,有,已经结婚了,自信/无神论/身材匀称,与父母同住,匀称,50,,,商业/贸易,,已婚,未婚,不限,无神论,,广东江门,,鼠,,,26~37岁,挑战者型,,,广东省,,不限,,巨蟹座,不吸烟，但不反感,不喝酒,想,"2000以下,4000-5000,7000-10000,15000-20000,30000-50000",2000以下,没有,,,,汉族,,,,,,9,生产/营运,B型,"与父母同住,已购房(无贷款)",,173~185厘米
56870805,27,河北,河北保定,1,中专/职高/技校,女,160,-,0,0,1,0,0,Chanel,有,,无神论/身材丰满,与父母同住,丰满,55,,,,,未婚,未婚,不限,无神论,,河北保定,,马,,,23~25岁,主人型,,,河北省,,不限,中文(普通话),天蝎座,不吸烟，但不反感,不喝酒,,4000-5000,2000以下,没有,,,,汉族,,,,,,,市场/公关,,已购房(无贷款),,170~175厘米
50565526,33,广东,广东东莞,2,本科,女,167,让我住进你的心里默然相爱寂静欢喜。。。谁在寻找着谁，谁又在等候着谁，谁又和谁在相依相偎...有缘无缘好像一切都像注定的一样...我在等你,0,1,0,0,1,紫苑,有,,厨艺不错/有神论/身材匀称/随和/看重感觉,住单位房,匀称,55,彼此相依相偎,,其它,能做几样可口的小菜,未婚,未婚,不限,信神但未定教,老大,江苏宿迁,一起分工合作,鼠,,性格，心灵,26~35岁,艺术家型,时机成熟时就结婚,,广东省,艺术类,不限,"中文(普通话),中文(广东话),英语",处女座,不吸，很反感,不喝酒,想,7000-10000,2000-5000,没有,中式婚礼，宴请宾客,,江汉大学,汉族,,,父母健在,,偶尔熬夜,7,艺术/设计/创意,B型,已购房(无贷款),,172~194厘米
20032790,40,北京,北京房山,0,本科,女,164,我是双子座女孩，很活泼，大部分时候是比较理性的。已经结婚了！！！！谢谢百合，也许比较长时间不来登录了,0,0,0,0,0,思思,无,已经结婚了,无神论/身材匀称/有房,已购房(无贷款),匀称,50,,,计算机/网络,,已婚,不限,不限,无神论,,北京东城,,马,,,28~33岁,作家型,,,北京市,,不限,,双子座,不吸烟，但不反感,不喝酒,想,"2000以下,4000-5000,7000-10000,15000-20000,30000-50000",2000-5000,没有,,,,汉族,,,,,,6,教育/培训,AB型,",与父母同住,需要时购置,已购房(无贷款),住单位房,住亲朋家",,169~179厘米
64314951,33,江苏,江苏南京,2,本科,女,161,谢谢你能仔细阅读我的资料！我是湖北人，现在也在湖北，资料里填写错误且无法更改~常常在想自己到底能不能不畏人言长久的等下去，一直等到那个一见倾心、再见甘愿奉其一生的人出现，我总是暗处在心底设定一个时限，如果到某年某月某日还没遇见让自己心动斩，就选择一个对我一往心深的，可是那个日期却总是无止境的往后推延……我知道，我还在等。还在等你的出现。我不知道还能坚持多久，但是希望你能在我放弃坚持之前出现。我是典型的被动型，可如果你是我喜欢的类型，我不会拒绝你的诚意邀约且必定坦诚相待。我等你！,0,1,0,0,1,babyfish,无,正在恋爱中,身材苗条/厨艺不错/想结婚/随和/无神论/自信,需要时购置,苗条,48,共赴浪漫之旅,事业单位,科研/教育,能做几样可口的小菜,未婚,未婚,不限,无神论,老二,湖北黄冈,一起分工合作,鼠,,性格，心灵,26~33岁,记者型,一年以内,,湖北省,中文类,不限,中文(普通话),狮子座,不吸烟，但不反感,社交需要喝,想,"4000-5000,7000-10000,15000-20000",2000-5000,没有,中式婚礼，宴请宾客,,湖北第二师范学院,汉族,,,父母健在,,偶尔懒散,8,教育/培训,A型,",与父母同住,需要时购置,已购房(无贷款),住单位房,住亲朋家",未购车,173~181厘米
50053932,35,上海,上海徐汇,0,本科,女,157,问世间情为何物，千山暮雪，只影向谁去？不如万水千山走遍，结伴同游人间！,0,0,0,0,0,百灵,无,,高管/身材匀称/自信/有神论,,匀称,49,,,,,未婚,未婚,不限,佛教,,安徽合肥,,猪,,,27~40岁,主人型,,,上海市,,不限,,白羊座,,,还没想好,"4000-5000,7000-10000,15000-20000,30000-50000",,没有,,,,汉族,,,,,,9,,其它,已购房(无贷款),,175~190厘米
58267704,38,湖南,湖南长沙,1,本科,女,164,相信缘分！！！！！！！！,0,0,1,0,0,0,无,已经结婚了,高管/自信/无神论/身材匀称/有房,已购房(有贷款),匀称,48,,,汽车,,已婚,"离异,丧偶",不限,无神论,,湖南长沙,,羊,,,35~43岁,哲学家型,,,湖南省,,不限,,魔羯座,不吸烟，但不反感,兴致时小酌,想,"4000-5000,7000-10000",5000-10000,有，和我住一起,,,,汉族,,,,,,10,高级经营管理,AB型,",与父母同住,需要时购置,已购房(无贷款),住单位房,住亲朋家",,170~174厘米
67263703,30,河南,河南郑州,3,大专,女,165,"爱情是不是永远的激情，而是淡淡生活中的细水常流，爱情需要真诚、宽容、专一来灌溉，爱情更是婚姻的通行证,在对的时间遇见对的人，是一生幸福。。。从现在开始你只能疼我一个人要宠我不能骗我答应我的每一件事都要做到，对我说的每一句话都要真心，不欺负我骂我要相信我，我开心呢你要陪我开心，我不开心你要哄我开心，别人欺负我你要第一时间出来帮我，永远都觉得我是最漂亮的，梦里要要见到我，在你的心里只有我..我要找到属于自己的幸福。",0,1,1,0,1,angel,有,已经结婚了,身材匀称/自信/无神论/随和/工作轻松/有上进心,与父母同住,匀称,,共赴浪漫之旅,,,不太会，但愿为心爱的人学习,已婚,未婚,不限,无神论,老二,,一起分工合作,兔,工作时间自由,经济实力,25~38岁,表演者型,一年以内,,河南省,艺术类,不限,中文(普通话),天蝎座,不吸，很反感,不喝酒,视情况而定,"2000以下,4000-5000,7000-10000,15000-20000,30000-50000",2000-5000,没有,户外婚礼，温馨浪漫,,,汉族,,,父母健在,,,10,其它,,已购房(无贷款),,170~185厘米
55792537,38,广西,广西区南宁,1,本科,女,158,下一站，幸福,0,0,1,0,0,下一站，幸福,无,已经结婚了,无神论/少数民族,与父母同住,,,,,,,已婚,未婚,不限,无神论,,,,羊,,,26~32岁,哲学家型,,,广西壮族自治区,,不限,中文(普通话),魔羯座,不吸烟，但不反感,兴致时小酌,还没想好,"2000以下,4000-5000,7000-10000,15000-20000,30000-50000",2000-5000,没有,,,,壮族,,,,,,5,其它,AB型,",与父母同住,需要时购置,已购房(无贷款),住单位房,住亲朋家",,173~183厘米
53164388,35,湖北,湖北武汉,3,高中,女,156,我是个介于活泼与文静之间的女孩，有时喜欢喧闹有时喜欢安静，偶尔有一点小脾气，希望找个好脾气的男人能够给我依靠。,0,1,1,0,1,紫冰,有,已经结婚了,身材匀称/无神论/自信,与父母同住,匀称,46,,,文化/娱乐/体育,,未婚,未婚,不限,无神论,,湖北宜昌,,猪,,,27~32岁,照顾者型,,,湖北省,,不限,中文(普通话),双鱼座,不吸烟，但不反感,不喝酒,想,"2000以下,4000-5000,7000-10000,15000-20000,30000-50000",2000以下,没有,,,,汉族,,,,,,8,艺术/设计/创意,A型,",与父母同住,需要时购置,已购房(无贷款),住单位房,住亲朋家",,170~176厘米
53772128,42,北京,北京朝阳,2,本科,女,168,欢迎到我的搏客点击文章“我的生活点滴”类型，了解更多的我。,0,0,1,0,1,月亮小鱼儿,有,正在恋爱中,自信/身材匀称/无神论,,匀称,60,,,食品业,,未婚,不限,不限,无神论,,辽宁丹东,,兔,,,32~42岁,领袖型,,,北京市,,不限,,狮子座,社交时偶尔吸烟,不喝酒,想,"15000-20000,30000-50000",5000-10000,没有,,,辽宁大学,汉族,,,,,,8,生产/营运,AB型,已购房(无贷款),,173~190厘米
57028631,28,江苏,江苏常州,1,高中,女,160,随着年龄的增长，想要一个可以一生的依靠遇到事情彼此能互相体谅我不喜欢男的经常出入娱乐场所（需要的时候可以）.....你可以吸烟，但不要过猛，你可以为所有的事喝酒，但不可以借酒消愁我希望你是一个成熟稳重的人由于我不是会员，希望不要发我看不到的哦....嘻嘻……,0,0,1,0,0,Ya、Ya,有,,看重感觉/有上进心/随和/无神论,与父母同住,胖,121,共赴浪漫之旅,,,不太会，但愿为心爱的人学习,未婚,未婚,不限,无神论,独生子女,江苏常州,看各自闲忙，协商分担,马,,性格，心灵,23~26岁,表演者型,时机成熟时就结婚,,江苏省,,不限,中文(普通话),双子座,不吸烟，但不反感,不喝酒,视情况而定,4000-5000,2000以下,没有,户外婚礼，温馨浪漫,,,汉族,,,父母健在,,没有规律,,其它,其它,已购房(无贷款),,175~180厘米
50331435,33,黑龙江,黑龙江哈尔滨,0,本科,女,160,"我算是一个开朗的人,朋友挺多,做事认真是我的优点同时也是缺点.做什么都要尽自己最大的努力去完成,无论是工作,学习还是其他．我是一个喜欢跟着感觉走的人．没什么特别的爱好．我感觉我是一个再普通不过的女孩．最喜欢休息方式是躺在床上看书或看电视.人是在变的,生活依然．但有些东西是不变的,要用心去体会.",0,0,0,0,0,hong,有,正在恋爱中,无神论/在校生/身材苗条,,较瘦,45,,,科研/教育,,未婚,未婚,不限,无神论,,北京东城,,牛,,,24~28岁,主人型,,,黑龙江省,,不限,,双鱼座,不吸烟，但不反感,兴致时小酌,想,"2000以下,7000-10000,15000-20000,30000-50000",2000以下,没有,,,,汉族,,,,,,5,在校学生,O型,",与父母同住,需要时购置,已购房(无贷款),住单位房,住亲朋家",,173~185厘米
54828404,26,浙江,浙江金华,3,大专,女,163,我来自金华武义，喜欢安静，是个比较文静的女孩，希望能找到适合我的另一半。,0,1,1,0,1,淰沵,无,,早起鸟/随和/有上进心/无神论/工作轻松/身材匀称,与父母同住,匀称,54,牵手漫步在公园,私营企业,制造业,不太会，但愿为心爱的人学习,离异,不限,不限,无神论,老大,浙江金华,看各自闲忙，协商分担,羊,轻松稳定,性格，心灵,26~30岁,艺术家型,三年以内,,浙江省,计算机类,不限,"中文(普通话),其它",射手座,不吸，很反感,兴致时小酌,想,7000-10000,2000-5000,没有,中式婚礼，宴请宾客,,,汉族,,,父母健在,,早睡早起,8,其它,B型,,需要时购置,175~178厘米
59215321,28,河南,河南许昌,1,中专/职高/技校,女,158,我的性格特点是：活泼开朗爱笑的。业余时间我喜欢：逛街上网打羽毛球。我憧憬的生活是：和心爱的一起旅游。只要生活幸福美满，和爱人做什么都是开心的。我希望我爱人是：有责任心，上进心，有孝心的。此外我还想补充：最好比我大的，我不喜欢比自己小的。,0,0,1,0,0,百合之恋,有,已经结婚了,自信/销售员/身材匀称/无神论,与父母同住,匀称,52,,,其它,,已婚,未婚,不限,无神论,,河南许昌,,蛇,,,22~30岁,挑战者型,,,河南省,,不限,中文(普通话),射手座,不吸烟，但不反感,兴致时小酌,想,"2000以下,4000-5000,7000-10000,15000-20000,30000-50000",2000以下,没有,,,,汉族,,,,,,8,销售,B型,已购房(无贷款),,170~178厘米
69044614,32,广西,广西贺州,3,本科,女,164,大家好，我是一个小女人，感性，开朗的女孩，现在常住地点在广西贺州，我平时的业余时间喜欢运动，旅行，希望在百合网能找到牵手一辈子的他。,0,1,1,0,1,茶玫玫,有,,自信/少数民族/无神论/厨艺不错/看重感觉/早起鸟,与父母同住,苗条,48,彼此相依相偎,事业单位,科研/教育,能做几样可口的小菜,未婚,不限,不限,无神论,老二,广西贺州,一起分工合作,虎,,性格，心灵,24~34岁,记者型,时机成熟时就结婚,,广西壮族自治区,外文类,不限,英语,白羊座,社交时偶尔吸烟,社交需要喝,想,"2000以下,4000-5000,7000-10000,15000-20000,30000-50000",2000-5000,没有,旅游结婚，不大操大办,,,其它民族,,,父母健在,,早睡早起,8,其它,A型,",与父母同住,需要时购置,已购房(无贷款),住单位房,住亲朋家",,174~184厘米
77202013,32,山东,山东济宁,2,大专,女,165,大家好，我是一个开朗的女孩，现在常住地点在山东省济宁市，我平时的业余时间喜欢唱歌，我的家庭是三口之家，我理想中的约会方式是体贴，对于我的另一半，我希望他是一个成熟稳重的男士……希望在百合网能找到牵手一辈子的他。,0,1,0,0,1,天天,有,正在恋爱中,无神论/身材匀称,,匀称,54,,,,,未婚,未婚,不限,无神论,,,,虎,,,25~31岁,公务员型,,,山东省,,不限,中文(普通话),双鱼座,不吸烟，但不反感,不喝酒,,4000-5000,2000-5000,没有,,,,汉族,,,,,,7,其它,,",与父母同住,需要时购置,已购房(无贷款),住单位房,住亲朋家",,172~185厘米
60225565,32,福建,福建福州,1,大专,女,165,本人性格活泼开朗，闲暇时比较喜欢去海边，喜欢的运动就是羽毛球，还有就是喜欢登山，还有就是桌球（不过不怎么会）！希望自己能找个与自己谈的来，思想方面成熟的，孝顺父母，有责任感和事业心的，有点幽默感的男的！,0,0,1,0,0,幸福一家人,有,已经结婚了,身材丰满/有上进心/随和/看重感觉/有神论,与父母同住,丰满,60,,,制造业,不太会，但愿为心爱的人学习,已婚,未婚,不限,佛教,老二,福建福州,看各自闲忙，协商分担,虎,,教育程度,25~37岁,教师型,时机成熟时就结婚,,福建省,,不限,中文(普通话),白羊座,不吸烟，但不反感,社交需要喝,想,"4000-5000,7000-10000,15000-20000,30000-50000",2000-5000,没有,,,,汉族,,,父母健在,,偶尔懒散,7,财务/审计/税务,O型,",与父母同住,需要时购置,已购房(无贷款),住单位房,住亲朋家",,170~196厘米
56270942,27,安徽,安徽合肥,2,大专,女,167,爱情不是永远的激情，而是淡淡生活中的细水常流，爱情需要真诚、宽容、专一来灌溉，爱情更是婚姻的通行证。我渴望一份朴实的爱情。有人说，在对的时间遇见对的人，是一生幸福。在对的时间里，我望穿秋水，等待一份真的情，等待一个对的人。,0,1,1,0,1,冰纯雪莲,有,正在恋爱中,看重感觉/工作轻松/有神论/随和/身材高挑/自信,,高挑,50,牵手漫步在公园,,金融/证券/保险,能做几样可口的小菜,未婚,未婚,不限,其它,独生子女,安徽合肥,看各自闲忙，协商分担,马,朝九晚五,性格，心灵,25~28岁,主人型,时机成熟时就结婚,,安徽省,,不限,"中文(普通话),英语",射手座,不吸，很反感,不喝酒,想,"4000-5000,7000-10000,15000-20000,30000-50000",2000-5000,没有,户外婚礼，温馨浪漫,,,汉族,,,父母健在,,偶尔熬夜,8,财务/审计/税务,O型,已购房(无贷款),未购车,175~185厘米
50192245,35,陕西,陕西西安,3,硕士,女,162,一个十分敏感的女孩。眼睛里总是看到与别人不同的东西，脑子里打转的也是一些异样的想法，对大部分事情不感什么兴趣。我的存在是个活问号，别说别人看不懂，有时自己也觉得难以真正了解；因为不愿受到太多烦杂的干扰！所以，在外人看来，感觉有点冷冷的，难以亲近！其实我心地很善良的，是个与众不同的“好女孩儿”！如果投缘，也会非常热情！说真的，我对工作的依赖性不是很强，愿望是想等到某天，终于休息下来，可以去很多遥远的地方……欢迎留言^_^,1,0,1,0,1,酉卒,有,,有神论/身材匀称/在校生/高学历,,匀称,55,,,其它,,未婚,未婚,不限,佛教,,河南濮阳,,猪,,,27~32岁,作家型,,,陕西省,,不限,,双鱼座,不吸烟，但不反感,不喝酒,还没想好,"2000以下,4000-5000,7000-10000,15000-20000,30000-50000",2000以下,没有,,,,汉族,,,,,,7,在校学生,A型,",与父母同住,需要时购置,已购房(无贷款),住单位房,住亲朋家",,173~180厘米
56962585,28,江西,江西赣州,1,本科,女,155,我喜欢喜欢旅游、看电影、逛街。我在业余时间最大的消遣是上网、看电影。我憧憬的生活是找到理想的另一半平淡、平静地度过下半生。我希望我未来的另一半最好是有上进心，懂得体贴人，斯文干净的男生。真心希望在这里能遇到我的那个TA!,0,0,1,0,0,米苏,有,已经结婚了,公务员/身材匀称/无神论,住亲朋家,匀称,,,,其它,,已婚,未婚,不限,无神论,,江西赣州,,蛇,,,22~28岁,学者型,,,江西省,,不限,,天秤座,不吸烟，但不反感,不喝酒,想,"2000以下,4000-5000,7000-10000,15000-20000,30000-50000",2000以下,没有,,,,汉族,,,,,,,公务员,,",与父母同住,需要时购置,已购房(无贷款),住单位房,住亲朋家",,165~180厘米
56498749,30,河北,河北唐山,1,大专,女,165,希望早日找到自己的另一半.,0,0,1,0,0,小胖墩,无,,工作轻松/无神论/身材匀称,,匀称,46,,,,,未婚,未婚,不限,无神论,,,,龙,工作时间自由,,26~34岁,学者型,,,河北省,,不限,中文(普通话),白羊座,社交时偶尔吸烟,不喝酒,,"2000以下,4000-5000,7000-10000,15000-20000,30000-50000",2000以下,没有,,,,汉族,,,,,,1,其它,其它,已购房(无贷款),,170~178厘米
76714593,28,辽宁,辽宁营口,0,本科,女,165,大家好，我是一个独立，感性，小女人，善良，开朗的女孩，现在常住地点在辽宁省营口市，希望在百合网能找到牵手一辈子的他。,0,0,0,0,0,weiwei,无,已经结婚了,无神论,,,,,,,,已婚,不限,不限,无神论,,,,马,,,20~30岁,,,,辽宁省,,不限,,双子座,不吸烟，但不反感,不喝酒,,"2000以下,4000-5000,7000-10000,15000-20000,30000-50000",2000以下,没有,,,,汉族,,,,,,,其它,,",与父母同住,需要时购置,已购房(无贷款),住单位房,住亲朋家",,165~185厘米
